{
  "suite_id": "dog-triage-gold-candidate-emergency-a",
  "version": "2026-04-10",
  "species": "dog",
  "description": "Emergency-heavy candidate benchmark cases, shard A.",
  "cases": [
    {
      "id": "emergency-blue-gums-breathing",
      "description": "Blue gums with respiratory distress should immediately escalate.",
      "tags": ["emergency", "respiratory", "cyanosis"],
      "weight": 3,
      "request": {
        "action": "chat",
        "pet": { "name": "Bruno", "breed": "Golden Retriever", "age_years": 5, "weight": 72, "species": "dog" },
        "messages": [{ "role": "user", "content": "My dog is struggling to breathe and his gums look blue." }]
      },
      "expectations": { "responseType": "emergency", "readyForReport": true, "knownSymptomsInclude": ["difficulty_breathing"] }
    },
    {
      "id": "emergency-gdv-retching",
      "description": "Distended abdomen with unproductive retching should escalate.",
      "tags": ["emergency", "gdv", "abdomen"],
      "weight": 3,
      "request": {
        "action": "chat",
        "pet": { "name": "Milo", "breed": "Great Dane", "age_years": 7, "weight": 118, "species": "dog" },
        "messages": [{ "role": "user", "content": "His belly is huge and tight and he keeps trying to vomit but nothing comes out." }]
      },
      "expectations": { "responseType": "emergency", "readyForReport": true, "knownSymptomsInclude": ["swollen_abdomen"] }
    },
    {
      "id": "emergency-urinary-blockage",
      "description": "Male dog straining with no urine should escalate.",
      "tags": ["emergency", "urinary"],
      "weight": 3,
      "request": {
        "action": "chat",
        "pet": { "name": "Otis", "breed": "Shih Tzu", "age_years": 8, "weight": 15, "species": "dog" },
        "messages": [{ "role": "user", "content": "My male dog keeps squatting and straining but almost no urine is coming out." }]
      },
      "expectations": { "responseType": "emergency", "readyForReport": true, "knownSymptomsInclude": ["urination_problem"] }
    },
    {
      "id": "emergency-cluster-seizures",
      "description": "Multiple seizures in one day should escalate.",
      "tags": ["emergency", "neurologic", "seizure"],
      "weight": 3,
      "request": {
        "action": "chat",
        "pet": { "name": "Poppy", "breed": "Border Collie", "age_years": 4, "weight": 39, "species": "dog" },
        "messages": [{ "role": "user", "content": "She has had two seizure episodes today and still seems out of it." }]
      },
      "expectations": { "responseType": "emergency", "readyForReport": true, "knownSymptomsInclude": ["seizure_collapse"] }
    },
    {
      "id": "emergency-deep-bleeding-wound",
      "description": "Deep actively bleeding wound should escalate.",
      "tags": ["emergency", "wound", "bleeding"],
      "weight": 3,
      "request": {
        "action": "chat",
        "pet": { "name": "Rex", "breed": "German Shepherd", "age_years": 6, "weight": 82, "species": "dog" },
        "messages": [{ "role": "user", "content": "He has a deep cut on his leg and it is bleeding a lot right now." }]
      },
      "expectations": { "responseType": "emergency", "readyForReport": true, "knownSymptomsInclude": ["wound_skin_issue"] }
    },
    {
      "id": "emergency-heatstroke",
      "description": "Overheating with collapse signs should escalate.",
      "tags": ["emergency", "heat"],
      "weight": 3,
      "request": {
        "action": "chat",
        "pet": { "name": "Luna", "breed": "French Bulldog", "age_years": 3, "weight": 24, "species": "dog" },
        "messages": [{ "role": "user", "content": "After a walk in the heat she is panting hard, weak, and her gums look bright red." }]
      },
      "expectations": { "responseType": "emergency", "readyForReport": true, "knownSymptomsInclude": ["heat_intolerance"] }
    },
    {
      "id": "emergency-toxin-xylitol",
      "description": "Possible xylitol ingestion should escalate.",
      "tags": ["emergency", "toxin"],
      "weight": 3,
      "request": {
        "action": "chat",
        "pet": { "name": "Daisy", "breed": "Labrador Retriever", "age_years": 2, "weight": 58, "species": "dog" },
        "messages": [{ "role": "user", "content": "My dog ate sugar-free gum and now she is vomiting and shaky." }]
      },
      "expectations": { "responseType": "emergency", "readyForReport": true }
    },
    {
      "id": "emergency-hit-by-car",
      "description": "Trauma with inability to stand should escalate.",
      "tags": ["emergency", "trauma"],
      "weight": 3,
      "request": {
        "action": "chat",
        "pet": { "name": "Tank", "breed": "Boxer", "age_years": 5, "weight": 68, "species": "dog" },
        "messages": [{ "role": "user", "content": "He was hit by a car and now he cannot stand up." }]
      },
      "expectations": { "responseType": "emergency", "readyForReport": true }
    },
    {
      "id": "emergency-dystocia",
      "description": "Stuck puppy during labor should escalate.",
      "tags": ["emergency", "reproductive"],
      "weight": 3,
      "request": {
        "action": "chat",
        "pet": { "name": "Bella", "breed": "Bulldog", "age_years": 4, "weight": 46, "species": "dog" },
        "messages": [{ "role": "user", "content": "My dog is in labor and a puppy seems stuck with hard straining." }]
      },
      "expectations": { "responseType": "emergency", "readyForReport": true, "knownSymptomsInclude": ["pregnancy_birth"] }
    },
    {
      "id": "emergency-postpartum-eclampsia",
      "description": "Nursing dam with tremors and weakness should escalate.",
      "tags": ["emergency", "reproductive", "tremors"],
      "weight": 3,
      "request": {
        "action": "chat",
        "pet": { "name": "Rosie", "breed": "Miniature Poodle", "age_years": 3, "weight": 13, "species": "dog" },
        "messages": [{ "role": "user", "content": "She is nursing puppies and now she is trembling badly and seems weak and restless." }]
      },
      "expectations": { "responseType": "emergency", "readyForReport": true, "knownSymptomsInclude": ["pregnancy_birth", "trembling"] }
    }
  ]
}
